{
  "id": "staff",
  "name": "Staff",
  "archetype": "staff",
  "damage_type": "arcane",
  "buffer_window": 0.2,
  "lunge_distance": 0.25,
  "perfect_dodge_moment": {"label": "Resonant Reply", "duration": 2.2, "damageMult": 1.32, "poiseMult": 1.4},
  "cancel_into": [
    "dodge",
    "guard"
  ],
  "cancel_after": 0.5,
  "scaling": {
    "staminaRegen": 1,
    "physicalDamage": 0.6
  },
  "hitbox": {
    "shape": "capsule",
    "radius": 0.3,
    "height": 2,
    "offset": [
      0,
      0,
      0.9
    ],
    "pitch_deg": 90
  },
  "light_attacks": [
    {
      "damage": 10,
      "poise_damage": 6,
      "stamina_cost": 0,
      "startup": 0.2,
      "active": 0.12,
      "recovery": 0.28,
      "lunge_distance": 0.2,
      "knockback": 1.0,
      "mana_cost": 10
    },
    {
      "damage": 12,
      "poise_damage": 8,
      "stamina_cost": 0,
      "startup": 0.22,
      "active": 0.14,
      "recovery": 0.3,
      "lunge_distance": 0.22,
      "heavy_branch": 0,
      "knockback": 1.0,
      "mana_cost": 12
    }
  ],
  "heavy_attack": {
    "damage": 24,
    "poise_damage": 20,
    "stamina_cost": 28,
    "startup": 0.35,
    "active": 0.18,
    "recovery": 0.45,
    "lunge_distance": 0.3,
    "knockback": 2.5
  },
  "heavy_attacks": [
    {
      "damage": 28,
      "poise_damage": 22,
      "stamina_cost": 24,
      "startup": 0.3,
      "active": 0.16,
      "recovery": 0.4,
      "damage_type": "arcane",
      "lunge_distance": 0.3,
      "cancel_after": 0.6,
      "knockback": 2.5
    }
  ],
  "running_attack": {
    "damage": 13,
    "poise_damage": 8,
    "stamina_cost": 12,
    "startup": 0.16,
    "active": 0.12,
    "recovery": 0.3,
    "damage_type": "arcane",
    "lunge_distance": 0.9,
    "cancel_after": 0.45,
    "knockback": 2.0
  },
  "rolling_attack": {
    "damage": 11,
    "poise_damage": 6,
    "stamina_cost": 11,
    "startup": 0.14,
    "active": 0.1,
    "recovery": 0.28,
    "damage_type": "arcane",
    "lunge_distance": 0.35,
    "cancel_after": 0.4,
    "knockback": 1.2
  },
  "art": {
    "id": "arcane_nova",
    "name": "Arcane Nova",
    "stamina_cost": 30,
    "damage": 32,
    "poise_damage": 28,
    "startup": 0.36,
    "active": 0.2,
    "recovery": 0.52,
    "lunge_distance": 0,
    "hyperarmor": true,
    "cooldown": 9,
    "knockback": 2.0
  }
}
