{
  "id": "castle_sword",
  "name": "Castle Sword",
  "archetype": "sword",
  "damage_type": "physical",
  "buffer_window": 0.2,
  "lunge_distance": 0.42,
  "perfect_dodge_moment": {"label": "Measured Reply", "duration": 2.2, "damageMult": 1.18, "poiseMult": 1.45},
  "cancel_into": [
    "dodge",
    "guard"
  ],
  "cancel_after": 0.5,
  "scaling": {
    "physicalDamage": 1,
    "armor": 0.02
  },
  "hitbox": {
    "shape": "box",
    "size": [
      1.25,
      0.85,
      1.45
    ],
    "offset": [
      0,
      -0.1,
      0.58
    ]
  },
  "light_attacks": [
    {
      "damage": 16,
      "poise_damage": 14,
      "stamina_cost": 12,
      "startup": 0.15,
      "active": 0.12,
      "recovery": 0.25,
      "lunge_distance": 0.38,
      "knockback": 1.4
    },
    {
      "damage": 20,
      "poise_damage": 16,
      "stamina_cost": 15,
      "startup": 0.18,
      "active": 0.14,
      "recovery": 0.28,
      "lunge_distance": 0.42,
      "heavy_branch": 0,
      "knockback": 1.4
    },
    {
      "damage": 26,
      "poise_damage": 22,
      "stamina_cost": 20,
      "startup": 0.22,
      "active": 0.16,
      "recovery": 0.35,
      "lunge_distance": 0.48,
      "knockback": 1.4
    }
  ],
  "heavy_attack": {
    "damage": 38,
    "poise_damage": 40,
    "stamina_cost": 32,
    "startup": 0.35,
    "active": 0.18,
    "recovery": 0.45,
    "lunge_distance": 0.58,
    "knockback": 3.2,
    "charge": {
      "max_time": 0.7,
      "damage_mult": 1.7,
      "poise_mult": 1.5,
      "stamina_mult": 1.35,
      "hyperarmor_at": 0.6
    }
  },
  "heavy_attacks": [
    {
      "damage": 44,
      "poise_damage": 48,
      "stamina_cost": 30,
      "startup": 0.3,
      "active": 0.18,
      "recovery": 0.42,
      "lunge_distance": 0.6,
      "hyperarmor": true,
      "cancel_after": 0.7,
      "knockback": 3.2
    }
  ],
  "running_attack": {
    "damage": 21,
    "poise_damage": 20,
    "stamina_cost": 16,
    "startup": 0.14,
    "active": 0.14,
    "recovery": 0.32,
    "lunge_distance": 1.15,
    "cancel_after": 0.45,
    "knockback": 2.8
  },
  "rolling_attack": {
    "damage": 17,
    "poise_damage": 13,
    "stamina_cost": 14,
    "startup": 0.1,
    "active": 0.12,
    "recovery": 0.3,
    "lunge_distance": 0.55,
    "cancel_after": 0.4,
    "knockback": 1.8
  },
  "art": {
    "id": "guard_break",
    "name": "Guard Break",
    "stamina_cost": 22,
    "damage": 36,
    "poise_damage": 48,
    "startup": 0.28,
    "active": 0.16,
    "recovery": 0.42,
    "lunge_distance": 0.55,
    "hyperarmor": true,
    "cooldown": 5,
    "knockback": 3.5
  },
  "plunge_attack": {
    "damage": 34,
    "poise_damage": 28,
    "stamina_cost": 20,
    "knockback": 4.0
  }
}
